Book Id,Title,Author,Author l-f,Additional Authors,ISBN,ISBN13,My Rating,Average Rating,Publisher,Publish Date,Date Read,Date Added,Bookshelves,Bookshelves with positions,Exclusive Shelf,My Review,Spoiler,Private Notes,Read Count,Recommended For,Recommended By,Owned Copies,Original Publication Year,Original Title,Language Code,Source,PageCount
43471951,The Great Gatsby,F. Scott Fitzgerald,Fitzgerald F. Scott,,978-0-7432-7356-5,9780743273565,5,3.89,Scribner,October 6 2004,2024-01-15,2024-01-15,"fiction, classics",""Finished"" (2024-01-15),read,A masterpiece of American literature. The writing is beautiful and the characters are compelling.,false,One of the best books ever written,1,classic literature lovers,,,1925,The Great Gatsby,en,Goodreads,180
41081609,To Kill a Mockingbird,Harper Lee,Lee Harper,,978-0-06-112008-4,9780061120084,5,4.27,J. B. Lippincott,June 30 1960,2024-02-10,2024-02-10,"fiction, classics",""Finished"" (2024-02-10),read,A powerful exploration of racism and morality in the American South.,false,Harper Lee's masterpiece,1,literature enthusiasts,,,1960,To Kill a Mockingbird,en,Goodreads,324
4651925,1984,George Orwell,Orwell George,,978-0451524935,9780451524935,,3.99,Signet Classics,August 13 2003,2024-03-10,2024-03-01,"dystopian, fiction",""Currently-reading"" (2024-03-10),currently-reading,Haunting and thought-provoking. A must-read dystopian novel.,false,Totalitarianism exploration,2,dystopia fans,,,1949,Nineteen Eighty-Four,en,Goodreads,328
7371681,Pride and Prejudice,Jane Austen,Austen Jane,,978-0141439518,9780141439518,,3.75,Penguin Classics,April 1 2002,,,2024-03-15,"romance, classics",""to-read"",,false,,0,,,,1813,Pride and Prejudice,en,Goodreads,279
76633277,The Hobbit,J.R.R. Tolkien,Tolkien J.R.R.,,978-0547928227,9780547928227,5,3.97,Houghton Mifflin Harcourt,September 18 2012,2023-05-20,2023-05-20,"fantasy, adventure",""Finished"" (2023-05-20),read,Epic adventure with wonderful worldbuilding. Tolkien's imagination is incredible.,false,One of the best fantasy books,1,fantasy lovers,,,1937,The Hobbit or There and Back Again,en,Goodreads,310
15839976,Dune,Frank Herbert,Herbert Frank,,978-0441172719,9780441172719,4,4.25,Ace,June 1 1992,2024-03-05,2024-02-25,"science-fiction, epic",""Currently-reading"" (2024-03-05),currently-reading,Dense and complex but fascinating. The political intrigue is compelling.,false,Complex sci-fi masterpiece,1,hard sci-fi readers,,,1965,Dune,en,Goodreads,688
41081609,The Catcher in the Rye,J.D. Salinger,Salinger J.D.,,978-0316769174,9780316769174,3,3.82,Back Bay Books,May 1 2004,2022-11-30,2022-11-30,"fiction, classics",""Finished"" (2022-11-30),read,Good coming-of-age story but the protagonist can be annoying.,false,Dated but important,1,classic literature readers,,,1951,The Catcher in the Rye,en,Goodreads,277
